{
  "data_path": "examples/batch_06.zip",
  "filelist_path": "examples/filelist_batch_06.txt",
  "use_scans_path": false,
  "factor_name": "classLabel",
  "qc_label": "QC",
  "galaxy": {
    "enabled": true,
    "api_key": "YOUR API KEY",
    "history_name": "Process metabolomics data (2)"
  },
  "skip_processing": false,
  "output_directory": "out_2",
  "process_scans": {
    "function_noise": "median",
    "snr_thres": 2.5,
    "ppm": 4.0,
    "min_fraction": 0.0,
    "min_scans": 1
  },
  "replicate_filter": {
    "replicates": 3,
    "min_peaks": 2,
    "ppm": 2.0,
    "rsd_thres": null
  },
  "align_samples": {
    "ppm": 2.0
  },
  "blank_filter": {
    "label": "blank",
    "min_fold_change": 10.0,
    "min_fraction": 1.0,
    "function": "mean"
  },
  "sample_filter": {
    "min_fraction": 0.8
  },
  "imputation": {
    "neighbours": 10,
    "feature_max": 50,
    "sample_max": 50
  },
  "normalisation": {
    "type": "pqn",
    "qc_label": "QC",
    "factor_name": "classLabel"
  },
  "transform": {
    "type": "glog",
    "qc_label": "QC",
    "factor_name": "classLabel"
  },
  "scaling": {
    "type": "mean"
  },
  "t_test": {
    "alpha": 0.05
  }
}
